{
  "schemaVersion": 1,
  "id": "navigation",
  "title": "Navigation",
  "kind": "core",
  "curriculum": [
    {
      "pointer": "/tracks/1/weeks/6/days/0/topics/1",
      "calendarDayIds": [
        "S31"
      ],
      "relation": "exact"
    },
    {
      "pointer": "/tracks/2/weeks/3/days/1/topics/1",
      "calendarDayIds": [
        "FT17"
      ],
      "relation": "exact"
    }
  ],
  "objectives": [
    {
      "id": "o1",
      "text": "Link between routes with Link and NavLink instead of a plain anchor, and explain what a full page reload loses"
    },
    {
      "id": "o2",
      "text": "Navigate from code after an event with useNavigate, including replacing the current history entry"
    }
  ],
  "prerequisites": [
    "react/effects-routing-and-rendering/routing-and-route-parameters"
  ],
  "minutes": {
    "aboutLabel": 10,
    "budget": 10,
    "modeledP50": 8,
    "modeledWorstPath": 10,
    "basis": "intake-plan: no page exists yet, so modeledP50 and modeledWorstPath are planning targets, not measurements. Targets: estimator P50 at most 8 minutes and worst required path (two wrong graded attempts and wrong-first explores per interactive unit) at most 10 minutes, set just above the measured course-1 range (estimator P50 4.78-7.95, worst path 6-9.35; authoring/evidence/git-linux-ai-foundations/intake.md). budget = ceil(max(modeledP50, modeledWorstPath)) per authoring/docs/tools/validators.md, capped at 15; aboutLabel covers the worst path. The module PR replaces modeledP50 with the frozen estimator's P50 on the page bytes and modeledWorstPath with the authored worst-path model, then re-derives budget and aboutLabel by the same rule. See authoring/evidence/react/intake.md, section Minute budgets."
  },
  "artifacts": {
    "html": {
      "status": "absent",
      "reason": "authored in the effects-routing-and-rendering module PR"
    },
    "md": {
      "status": "absent",
      "reason": "authored in the effects-routing-and-rendering module PR"
    },
    "pdf": {
      "status": "absent",
      "reason": "Not applicable: core topic; a PDF is present only for Reading topics and topics that declare a print handout"
    },
    "gift": {
      "status": "absent",
      "reason": "authored in the effects-routing-and-rendering module PR"
    },
    "video": {
      "status": "absent",
      "reason": "authored in the effects-routing-and-rendering module PR only if a documented search qualifies a live, public, embeddable video within the topic budget; otherwise recorded absent there with the search record"
    },
    "lab": {
      "status": "absent",
      "reason": "Standard: covered by the planned module lab react/effects-routing-and-rendering/coding-lab/ for the S31 Lab day, authored in the effects-routing-and-rendering module PR. Course project: applied in part P2 of the planned cumulative course project react/coding-lab/ (Fast FT17 increment), after an embedded teach-then-check step; authored in a course-level PR"
    }
  },
  "freshness": {
    "status": "unverified",
    "checkedAt": null,
    "sourcesRef": "authoring/evidence/react/source-snapshot.json",
    "unverifiedItems": [
      "No page is authored yet: the official source list was frozen live at intake on 2026-10-12 (authoring/evidence/react/source-snapshot.json); every claim is bound to those sources and verified by SME criticism in the effects-routing-and-rendering module PR."
    ]
  },
  "licensing": [],
  "lab": "module:effects-routing-and-rendering",
  "components": {}
}
