{
  "schemaVersion": 1,
  "id": "the-box-model",
  "title": "The box model",
  "kind": "core",
  "curriculum": [
    {
      "pointer": "/tracks/1/weeks/3/days/4/topics/3",
      "calendarDayIds": [
        "S20"
      ],
      "relation": "exact"
    },
    {
      "pointer": "/tracks/2/weeks/2/days/1/topics/3",
      "calendarDayIds": [
        "FT12"
      ],
      "relation": "exact"
    }
  ],
  "objectives": [
    {
      "id": "o1",
      "text": "Label the content, padding, border and margin areas of a box"
    },
    {
      "id": "o2",
      "text": "Calculate an element's rendered width under box-sizing content-box and border-box"
    },
    {
      "id": "o3",
      "text": "Predict when adjacent vertical margins collapse"
    }
  ],
  "prerequisites": [
    "html-css-js/html-and-css/semantic-html-page-structure"
  ],
  "minutes": {
    "aboutLabel": 10,
    "budget": 10,
    "modeledP50": 7.97,
    "modeledWorstPath": 9.97,
    "basis": "modeledP50: P50 of the frozen authoring/tools/timing/estimate_reading.py (sha256 0deca96bf5e367aeae51a82abdbd4b6ce0d0289ecc9868c9eff3701016edf96f) on the current artifact.html bytes. modeledWorstPath: modeledP50 + 2.0 minutes, the module review model of the worst required route: the prediction is not graded (+0); each of the three practice activities is taken wrong first, reading its feedback and retrying (+0.5 each, +1.5); the apply check is answered wrong twice, reading the retry form, the settled answer and the option explanations (+0.5). budget and aboutLabel = ceil(max(modeledP50, modeledWorstPath)), under authoring/docs/tools/validators.md (cap 15). See authoring/evidence/html-css-js/intake.md, section Minute budgets."
  },
  "artifacts": {
    "html": {
      "status": "present"
    },
    "md": {
      "status": "present"
    },
    "pdf": {
      "status": "absent",
      "reason": "Not applicable: core topic; the PDF applies only to Reading topics or a printHandout topic"
    },
    "gift": {
      "status": "present"
    },
    "video": {
      "status": "absent",
      "reason": "No verified video: the 2026-10-14 search found only unverified titles, and none fits the 8-minute S20 Short video block shared by four topics after verification; see authoring/evidence/html-css-js/html-and-css/video-search.md."
    },
    "lab": {
      "status": "absent",
      "reason": "No coding lab: the objectives are practised in the page's own simulators, and this topic falls on a Concept day with no calendar lab day; see authoring/evidence/html-css-js/intake.md, section Lab plan"
    }
  },
  "freshness": {
    "status": "unverified",
    "checkedAt": "2026-10-14",
    "sourcesRef": "authoring/evidence/html-css-js/html-and-css/the-box-model/sources.json",
    "unverifiedItems": [
      "Sources fetched live on 2026-10-14 (HTTP 200, receipt in sourcesRef) and each page claim mapped in sectionsUsed; the independent SME critic and its recheck closed with no open findings, but neither records a claim-by-claim check against these sources, so the topic stays unverified until a reviewer records one."
    ]
  },
  "licensing": [],
  "lab": "none",
  "components": {
    "progress": "1",
    "restart": "1"
  }
}
