{
  "schemaVersion": 1,
  "id": "timed-coding-screen-patterns",
  "title": "Timed coding-screen patterns",
  "kind": "review",
  "curriculum": [
    {
      "pointer": "/tracks/0/weeks/5/days/2/topics/1",
      "calendarDayIds": [
        "F28"
      ],
      "relation": "exact"
    }
  ],
  "objectives": [
    {
      "id": "o1",
      "text": "Recognize which pattern fits a short problem statement: a HashMap frequency count, a HashSet of seen values, an ArrayDeque stack, or two pointers"
    },
    {
      "id": "o2",
      "text": "Solve a short problem inside a time box by restating the inputs and outputs, listing edge cases, then coding and testing the simplest correct version"
    },
    {
      "id": "o3",
      "text": "State a solution's time complexity in Big-O terms out loud"
    }
  ],
  "prerequisites": [
    "collections-streams/collections-in-depth/choosing-the-right-collection",
    "collections-streams/collections-in-depth/big-o-basics",
    "java-foundations"
  ],
  "minutes": {
    "aboutLabel": 15,
    "budget": 15,
    "modeledP50": 12.1,
    "modeledWorstPath": 14.85,
    "basis": "Frozen estimator on the 2026-10-16 correction bytes: P50 12.1 minutes (code editors are marked data-interaction=terminal with data-steps for their modeled edit-and-Run cycles, the estimator category already used by repository code workspaces). The worst required route adds one extra graded attempt for the pattern set (+45 s), and the full 6-minute time box in place of the modeled 4 minutes of Activity 2 plan and code work (+2 min); the self-check has no retry, giving 14.85 minutes. budget and aboutLabel are ceil(max(P50, worst path)) = 15, within the 15-minute ceiling."
  },
  "artifacts": {
    "html": {
      "status": "present"
    },
    "md": {
      "status": "present"
    },
    "pdf": {
      "status": "absent",
      "reason": "Not applicable: review topic; review topics carry HTML and Markdown only"
    },
    "gift": {
      "status": "absent",
      "reason": "Not applicable: review topic; the review page is itself retrieval practice, so review topics carry HTML and Markdown only"
    },
    "video": {
      "status": "absent",
      "reason": "Not applicable: review topic; review topics carry HTML and Markdown only"
    },
    "lab": {
      "status": "absent",
      "reason": "No coding lab: the page's own checks give the review practice, and the F28 Review day's 'Practice without AI' coding-lab block is platform practice, not a repository lab"
    }
  },
  "freshness": {
    "status": "partially-verified",
    "checkedAt": "2026-10-16",
    "sourcesRef": "authoring/evidence/collections-streams/lambdas-and-streams/timed-coding-screen-patterns/sources.json",
    "unverifiedItems": [
      "Official Java SE 25, JLS, dev.java and PostgreSQL 18 sources linked by artifact.html returned HTTP 200 on 2026-10-16 (sources.json); Java/Streams-SME review of the current bytes is pending.",
      "Java behavior shown by the offline practice editor was checked against a local JDK 17 for the cases recorded in readiness evidence; Java SE 25 behavior is asserted from the official sources, not from a JDK 25 run.",
      "The current artifact bytes have not yet received the required independent education or Java/Streams-SME critic reviews."
    ]
  },
  "licensing": [],
  "lab": "none",
  "components": {}
}
