{
  "schemaVersion": 1,
  "id": "logging-in-spring",
  "title": "Reading: logging in Spring",
  "kind": "reading",
  "curriculum": [
    {
      "pointer": "/tracks/1/weeks/2/days/0/topics/2",
      "calendarDayIds": [
        "S11"
      ],
      "relation": "exact"
    },
    {
      "pointer": "/tracks/2/weeks/0/days/4/topics/3",
      "calendarDayIds": [
        "FT5"
      ],
      "relation": "shared"
    }
  ],
  "objectives": [
    {
      "id": "o1",
      "text": "Log with an SLF4J logger at the right level and set levels per package with logging.level properties"
    },
    {
      "id": "o2",
      "text": "Read Spring Boot's default console log line to find the time, level, thread, logger and message"
    },
    {
      "id": "o3",
      "text": "Keep secrets and personal data out of log messages"
    }
  ],
  "prerequisites": [
    "java-foundations/exceptions-and-logging/logging"
  ],
  "minutes": {
    "aboutLabel": 9,
    "budget": 9,
    "modeledP50": 6,
    "modeledWorstPath": 8.5,
    "basis": "intake planning model under the new-course budget rule (authoring/docs/tools/validators.md, Reading time): no artifact.html exists yet, so modeledP50 is the intake target for a Reading page (6 minutes) and modeledWorstPath adds 2.5 minutes for the worst required route (two wrong graded attempts and wrong-first explores per interactive unit; course-1 measured worst-path gaps were 2.41-2.65 minutes above P50). budget = aboutLabel = ceil(max(modeledP50, modeledWorstPath)) = 9. The integration-and-observability module PR replaces modeledP50 with the frozen estimator P50 (authoring/tools/timing/estimate_reading.py, sha256 0deca96bf5e367aeae51a82abdbd4b6ce0d0289ecc9868c9eff3701016edf96f) on the authored bytes, re-models the worst path, and keeps budget at least ceil(max(P50, worst path)) and at most 15; T14 then checks the day totals. See authoring/evidence/spring-boot/intake.md, section Minute budgets."
  },
  "artifacts": {
    "html": {
      "status": "absent",
      "reason": "authored in the integration-and-observability module PR"
    },
    "md": {
      "status": "absent",
      "reason": "authored in the integration-and-observability module PR"
    },
    "pdf": {
      "status": "absent",
      "reason": "authored in the integration-and-observability module PR (printable handout for this Reading topic)"
    },
    "gift": {
      "status": "absent",
      "reason": "authored in the integration-and-observability module PR"
    },
    "video": {
      "status": "absent",
      "reason": "authored in the integration-and-observability module PR only if a live, public, embeddable first-party or reputable video qualifies within the budget; otherwise it stays absent with the search record"
    },
    "lab": {
      "status": "absent",
      "reason": "No topic-level coding lab: practised in the planned integration-and-observability module lab (Standard lab overlay, S11), authored in the integration-and-observability module PR; Fast skips coding labs"
    }
  },
  "freshness": {
    "status": "unverified",
    "checkedAt": null,
    "sourcesRef": "authoring/evidence/spring-boot/source-snapshot.json",
    "unverifiedItems": [
      "Not yet verified: no page is authored yet. The intake froze first-party sources in authoring/evidence/spring-boot/source-snapshot.json (retrieved 2026-10-13); module PR SME criticism verifies every claim on the authored bytes against live sources."
    ]
  },
  "licensing": [],
  "lab": "module:integration-and-observability",
  "components": {}
}
