{
  "schemaVersion": 1,
  "id": "jdbc-review",
  "title": "Review: JDBC",
  "kind": "review",
  "curriculum": [
    {
      "pointer": "/tracks/0/weeks/4/days/3/topics/1",
      "calendarDayIds": [
        "F24"
      ],
      "relation": "exact"
    }
  ],
  "objectives": [
    {
      "id": "o1",
      "text": "Retrieve and apply the steps to query a database from Java: get a Connection, prepare a statement, execute it, read the ResultSet and close resources with try-with-resources"
    },
    {
      "id": "o2",
      "text": "Explain why a PreparedStatement with ? parameters prevents SQL injection where string concatenation does not"
    },
    {
      "id": "o3",
      "text": "Decide when to group statements in one transaction with setAutoCommit(false), commit and rollback"
    }
  ],
  "prerequisites": [
    "jdbc-data-access-project"
  ],
  "minutes": {
    "aboutLabel": 15,
    "budget": 15,
    "modeledP50": 10.45,
    "modeledWorstPath": 14.03,
    "basis": "modeledP50: P50 of the frozen authoring/tools/timing/estimate_reading.py (sha256 0deca96bf5e367aeae51a82abdbd4b6ce0d0289ecc9868c9eff3701016edf96f) on this artifact.html (1013 prose words, 27 code lines, interactions {\"confidence\": 3, \"drag\": 1, \"explore\": 1, \"mcq\": 2, \"predict\": 1}). modeledWorstPath: P50 plus the worst required route per interactive unit: each of the 2 graded checks answered wrong once more (a second 45 s attempt, 5 s confidence and 15 s to read the explanations, 65 s each); each of the 5 lane items placed wrong once before the right lane (10 s each to press and read the feedback); the injection explorer built once with a value that has no quote before the quoted value (20 s); the prediction's per-option explanations read in full (15 s): 10.45 + 215 s = 14.03. budget and aboutLabel: ceil(max(modeledP50, modeledWorstPath)) = 15 per authoring/docs/tools/validators.md (Reading time, T14), set from the authored page's honest minimum rather than the intake target."
  },
  "artifacts": {
    "html": {
      "status": "present"
    },
    "md": {
      "status": "present"
    },
    "pdf": {
      "status": "absent",
      "reason": "Not applicable: review topic; review topics carry HTML and Markdown only"
    },
    "gift": {
      "status": "absent",
      "reason": "Not applicable: review topic; the review page is itself retrieval practice, so review topics carry HTML and Markdown only"
    },
    "video": {
      "status": "absent",
      "reason": "Not applicable: review topic; review topics carry HTML and Markdown only"
    },
    "lab": {
      "status": "absent",
      "reason": "No topic coding lab: the F24 Review day's platform 'Practice without AI' block covers hands-on practice; the review page adds no new syllabus"
    }
  },
  "freshness": {
    "status": "partially-verified",
    "checkedAt": "2026-10-16",
    "sourcesRef": "authoring/evidence/sql-jdbc-foundations/reporting-indexes-and-review/jdbc-review/sources.json",
    "unverifiedItems": [
      "Sources fetched live on 2026-10-16 (HTTP 200, receipt in sourcesRef) and the page's claims checked against the sections listed there by the author; the module SME critic has not yet re-verified them.",
      "Java behaviour (try-with-resources close order, ResultSet cursor, auto-commit default) is taken from the Java SE 25 API and tutorial pages; no Java program was run for this page."
    ]
  },
  "licensing": [],
  "lab": "none",
  "components": {}
}
