{
  "schemaVersion": 1,
  "id": "ai-rules-of-use",
  "title": "Rules of use: what to share and redact",
  "kind": "reading",
  "curriculum": [
    {
      "pointer": "/tracks/0/weeks/0/days/0/topics/4",
      "calendarDayIds": [
        "F1"
      ],
      "relation": "split"
    }
  ],
  "objectives": [
    {
      "id": "o1",
      "text": "Sort project material into share, redact first, or never share before it reaches a prompt"
    },
    {
      "id": "o2",
      "text": "Redact the secret and personal parts of a message while keeping the part that helps"
    }
  ],
  "prerequisites": [
    "git-linux-ai-foundations/ai-foundations/ai-assistant-setup"
  ],
  "minutes": {
    "aboutLabel": 8,
    "budget": 8,
    "modeledP50": 5.4,
    "modeledWorstPath": 7.57,
    "basis": "aboutLabel: legacy module.json minutes (git-linux-ai-foundations-20261007-evolv-terminal-repair). budget: the captain-approved legacy minutes label (course-1 timing resolution recorded in authoring/evidence/git-linux-ai-foundations/intake.md, section Minute budgets). modeledP50: p50 of the frozen tools/timing/estimate_reading.py (sha256 0deca96bf5e367aeae51a82abdbd4b6ce0d0289ecc9868c9eff3701016edf96f) run on the current artifact.html after the module PR added the contract header (about label and objectives) and static alternatives; it was 5.14 on the authoritative legacy page bytes. modeledWorstPath: legacy worst-required-route value (ai-foundations module.json timing.worstRequiredRetryP50 = 7.31, two wrong graded attempts and wrong-first explores per interactive unit) plus the 0.21-minute estimator P50 increase from the added header, giving 7.52. The accepted module-critic corrections changed the estimator P50 by 0.05 (to 5.4); modeledWorstPath moved by the same delta to 7.57. See authoring/evidence/git-linux-ai-foundations/intake.md, section Minute budgets."
  },
  "artifacts": {
    "html": {
      "status": "present"
    },
    "md": {
      "status": "present"
    },
    "pdf": {
      "status": "present"
    },
    "gift": {
      "status": "present"
    },
    "video": {
      "status": "present"
    },
    "lab": {
      "status": "absent",
      "reason": "No topic coding lab: the objectives are practised in the page's own simulators; the course-level lab decision is pending plan step R5"
    }
  },
  "freshness": {
    "status": "unverified",
    "checkedAt": "2026-10-12",
    "sourcesRef": "authoring/evidence/git-linux-ai-foundations/ai-foundations/ai-rules-of-use/sources.json",
    "unverifiedItems": [
      "Source liveness re-checked in this repository on 2026-10-12 (HTTP 200, final URL, retrieval time and response sha256 per source in authoring/evidence/git-linux-ai-foundations/ai-foundations/ai-rules-of-use/sources.json); claim-by-claim re-verification of the imported bytes against those sources is pending the module SME critic (plan step R6). Legacy record (git-linux-ai-foundations-20261007-evolv-terminal-repair): freshness partially-verified on 2026-10-06 against the legacy page bytes.",
      "Legacy unverified item: The share / redact first / never share lanes and placeholder style are this lesson's teaching model, not a quoted standard; data handling and retention differ by provider and plan and were not checked per provider."
    ]
  },
  "licensing": [],
  "lab": "none",
  "components": {}
}
