{
  "schemaVersion": 1,
  "id": "enums",
  "title": "Enums",
  "kind": "core",
  "curriculum": [
    {
      "pointer": "/tracks/0/weeks/2/days/0/topics/4",
      "calendarDayIds": [
        "F11"
      ],
      "relation": "exact"
    }
  ],
  "objectives": [
    {
      "id": "o1",
      "text": "Declare an enum for a fixed set of constants and use it in a switch"
    },
    {
      "id": "o2",
      "text": "Add a field, constructor and method to an enum"
    },
    {
      "id": "o3",
      "text": "Choose an enum over int or String constants and explain the type safety it adds"
    }
  ],
  "prerequisites": [
    "java-foundations/classes-and-objects/classes-and-objects",
    "java-foundations/classes-and-objects/constructors",
    "java-foundations/java-basics/if-else-and-switch"
  ],
  "minutes": {
    "aboutLabel": 10,
    "budget": 10,
    "modeledP50": 0,
    "modeledWorstPath": 0,
    "basis": "Intake planning budget for a core page under the new-course rule in authoring/docs/tools/validators.md (B8): no artifact.html exists yet, so modeledP50 and modeledWorstPath are 0 (not measured), not estimates. The planning value is the largest ceil(max(estimator P50, worst path)) measured on a course-1 page (10 minutes, agile-scrum-user-stories). The module PR measures the authored page with the frozen estimator, models the worst required path, and raises budget and aboutLabel to at least ceil(max(P50, modeledWorstPath)), at most 15, without compressing other topics. See authoring/evidence/java-foundations/intake.md, section Minute budgets."
  },
  "artifacts": {
    "html": {
      "status": "absent",
      "reason": "authored in the classes-and-objects module PR"
    },
    "md": {
      "status": "absent",
      "reason": "authored in the classes-and-objects module PR"
    },
    "pdf": {
      "status": "absent",
      "reason": "Not applicable: core topic with no print handout; the PDF applies only to pages derived from Reading source rows"
    },
    "gift": {
      "status": "absent",
      "reason": "authored in the classes-and-objects module PR"
    },
    "video": {
      "status": "absent",
      "reason": "authored in the classes-and-objects module PR when a suitable verified video exists; otherwise recorded absent there with the search record"
    },
    "lab": {
      "status": "absent",
      "reason": "No topic coding lab planned at intake: the objectives are practised in the page's own simulators and the calendar day's platform coding-lab blocks; the module PR may propose a module lab under authoring/docs/lab-contract.md"
    }
  },
  "freshness": {
    "status": "unverified",
    "checkedAt": null,
    "sourcesRef": "authoring/evidence/java-foundations/source-snapshot.json",
    "unverifiedItems": [
      "Not yet verified in this repository: no page is authored. The module PR SME critic verifies every claim against the intake sources in authoring/evidence/java-foundations/source-snapshot.json and live official documentation."
    ]
  },
  "licensing": [],
  "lab": "none",
  "components": {}
}
