{
  "schemaVersion": 1,
  "id": "lists-dicts-sets-and-tuples",
  "title": "Lists, dicts, sets and tuples",
  "kind": "core",
  "curriculum": [
    {
      "pointer": "/tracks/1/weeks/2/days/3/topics/2",
      "calendarDayIds": [
        "S14"
      ],
      "relation": "exact"
    },
    {
      "pointer": "/tracks/2/weeks/1/days/3/topics/2",
      "calendarDayIds": [
        "FT9"
      ],
      "relation": "exact"
    }
  ],
  "objectives": [
    {
      "id": "o1",
      "text": "Choose a list, dict, set or tuple for a described data need and justify the choice by ordering, uniqueness, mutability and lookup by key"
    },
    {
      "id": "o2",
      "text": "Add, look up, update and remove entries in a list and a dict, using dict.get to handle a missing key without a KeyError"
    },
    {
      "id": "o3",
      "text": "Iterate over a dict with items() and unpack each key-value pair into two variables"
    }
  ],
  "prerequisites": [
    "python/python-fundamentals/python-syntax-for-java-developers"
  ],
  "minutes": {
    "aboutLabel": 12,
    "budget": 12,
    "modeledP50": 9,
    "modeledWorstPath": 11.5,
    "basis": "intake planning model under the new-course budget rule (authoring/docs/tools/validators.md, Reading time): no artifact.html exists yet, so modeledP50 is the intake target for a core page (9 minutes) and modeledWorstPath adds 2.5 minutes for the worst required route (two wrong graded attempts and wrong-first explores per interactive unit; course-1 measured worst-path gaps were 2.41-2.65 minutes above P50). budget = aboutLabel = ceil(max(modeledP50, modeledWorstPath)) = 12. The python-fundamentals module PR replaces modeledP50 with the frozen estimator P50 (authoring/tools/timing/estimate_reading.py, sha256 0deca96bf5e367aeae51a82abdbd4b6ce0d0289ecc9868c9eff3701016edf96f) on the authored bytes, re-models the worst path, and keeps budget at least ceil(max(P50, worst path)) and at most 15; T14 then checks the day totals. See authoring/evidence/python/intake.md, section Minute budgets."
  },
  "artifacts": {
    "html": {
      "status": "absent",
      "reason": "authored in the python-fundamentals module PR"
    },
    "md": {
      "status": "absent",
      "reason": "authored in the python-fundamentals module PR"
    },
    "pdf": {
      "status": "absent",
      "reason": "Not applicable: core topic with no print handout; in this course the PDF applies only to the Reading topic keeping-sensitive-data-out-of-prompts"
    },
    "gift": {
      "status": "absent",
      "reason": "authored in the python-fundamentals module PR"
    },
    "video": {
      "status": "absent",
      "reason": "authored in the python-fundamentals module PR only if a live, public, embeddable first-party or reputable video qualifies within the budget; otherwise it stays absent with the search record"
    },
    "lab": {
      "status": "absent",
      "reason": "No topic coding lab: the objectives are practised in the page's own simulators, and the confirmed expected-artifact scope (matrix v3) gives this Concept-day topic no lab overlay; the educational critic confirms the omission"
    }
  },
  "freshness": {
    "status": "unverified",
    "checkedAt": null,
    "sourcesRef": "authoring/evidence/python/source-snapshot.json",
    "unverifiedItems": [
      "Not yet verified: no page is authored yet. The intake froze first-party sources in authoring/evidence/python/source-snapshot.json (retrieved 2026-10-12); module PR SME criticism verifies every claim on the authored bytes against live sources."
    ]
  },
  "licensing": [],
  "lab": "none",
  "components": {}
}
