{
  "schemaVersion": 1,
  "id": "common-api-security-risks-owasp",
  "title": "Reading: common API security risks (OWASP)",
  "kind": "reading",
  "curriculum": [
    {
      "pointer": "/tracks/1/weeks/2/days/1/topics/5",
      "calendarDayIds": [
        "S12"
      ],
      "relation": "exact"
    },
    {
      "pointer": "/tracks/2/weeks/1/days/1/topics/5",
      "calendarDayIds": [
        "FT7"
      ],
      "relation": "shared"
    }
  ],
  "objectives": [
    {
      "id": "o1",
      "text": "Identify three common risks for this course's API in described endpoints: broken object level authorization (API1), broken authentication (API2) and broken function level authorization (API5) from the OWASP API Security Top 10 2023; the full list is optional reference"
    },
    {
      "id": "o2",
      "text": "Identify broken object level authorization in a described endpoint and the ownership check that fixes it"
    },
    {
      "id": "o3",
      "text": "Connect earlier course practices (validation, DTOs, error bodies without internals, password hashing, role checks) to the risks they reduce"
    }
  ],
  "prerequisites": [
    "spring-boot/api-security/role-protected-endpoints"
  ],
  "minutes": {
    "aboutLabel": 9,
    "budget": 9,
    "modeledP50": 6,
    "modeledWorstPath": 8.5,
    "basis": "intake planning model under the new-course budget rule (authoring/docs/tools/validators.md, Reading time): no artifact.html exists yet, so modeledP50 is the intake target for a Reading page (6 minutes) and modeledWorstPath adds 2.5 minutes for the worst required route (two wrong graded attempts and wrong-first explores per interactive unit; course-1 measured worst-path gaps were 2.41-2.65 minutes above P50). budget = aboutLabel = ceil(max(modeledP50, modeledWorstPath)) = 9. The api-security module PR replaces modeledP50 with the frozen estimator P50 (authoring/tools/timing/estimate_reading.py, sha256 0deca96bf5e367aeae51a82abdbd4b6ce0d0289ecc9868c9eff3701016edf96f) on the authored bytes, re-models the worst path, and keeps budget at least ceil(max(P50, worst path)) and at most 15; T14 then checks the day totals. See authoring/evidence/spring-boot/intake.md, section Minute budgets."
  },
  "artifacts": {
    "html": {
      "status": "absent",
      "reason": "authored in the api-security module PR"
    },
    "md": {
      "status": "absent",
      "reason": "authored in the api-security module PR"
    },
    "pdf": {
      "status": "absent",
      "reason": "authored in the api-security module PR (printable handout for this Reading topic)"
    },
    "gift": {
      "status": "absent",
      "reason": "authored in the api-security module PR"
    },
    "video": {
      "status": "absent",
      "reason": "authored in the api-security module PR only if a live, public, embeddable first-party or reputable video qualifies within the budget; otherwise it stays absent with the search record"
    },
    "lab": {
      "status": "absent",
      "reason": "No topic-level coding lab: practised in the planned api-security module lab (Standard lab overlay, S12), authored in the api-security module PR; Fast skips coding labs"
    }
  },
  "freshness": {
    "status": "unverified",
    "checkedAt": null,
    "sourcesRef": "authoring/evidence/spring-boot/source-snapshot.json",
    "unverifiedItems": [
      "Not yet verified: no page is authored yet. The intake froze first-party sources in authoring/evidence/spring-boot/source-snapshot.json (retrieved 2026-10-13); module PR SME criticism verifies every claim on the authored bytes against live sources."
    ]
  },
  "licensing": [],
  "lab": "module:api-security",
  "components": {}
}
