{
  "schemaVersion": 1,
  "id": "python-review",
  "title": "Python review",
  "kind": "review",
  "curriculum": [
    {
      "pointer": "/tracks/1/weeks/3/days/3/topics/0",
      "calendarDayIds": [
        "S19"
      ],
      "relation": "exact"
    }
  ],
  "objectives": [
    {
      "id": "o1",
      "text": "Retrieve and apply Python syntax, collections, mutability, exceptions and pytest on mixed practice tasks without new material"
    },
    {
      "id": "o2",
      "text": "Trace a small extract, validate, load and serve flow end to end and locate where a described defect (aliasing, missing validation or missing timeout) would surface"
    }
  ],
  "prerequisites": [
    "python/fastapi-services/calling-the-spring-boot-api-from-fastapi-service-url-token-and-timeouts"
  ],
  "minutes": {
    "aboutLabel": 12,
    "budget": 12,
    "modeledP50": 9,
    "modeledWorstPath": 11.5,
    "basis": "intake planning model under the new-course budget rule (authoring/docs/tools/validators.md, Reading time): no artifact.html exists yet, so modeledP50 is the intake target for a review page (9 minutes) and modeledWorstPath adds 2.5 minutes for the worst required route (two wrong graded attempts and wrong-first explores per interactive unit; course-1 measured worst-path gaps were 2.41-2.65 minutes above P50). budget = aboutLabel = ceil(max(modeledP50, modeledWorstPath)) = 12. The fastapi-services module PR replaces modeledP50 with the frozen estimator P50 (authoring/tools/timing/estimate_reading.py, sha256 0deca96bf5e367aeae51a82abdbd4b6ce0d0289ecc9868c9eff3701016edf96f) on the authored bytes, re-models the worst path, and keeps budget at least ceil(max(P50, worst path)) and at most 15; T14 then checks the day totals. See authoring/evidence/python/intake.md, section Minute budgets."
  },
  "artifacts": {
    "html": {
      "status": "absent",
      "reason": "authored in the fastapi-services module PR"
    },
    "md": {
      "status": "absent",
      "reason": "authored in the fastapi-services module PR"
    },
    "pdf": {
      "status": "absent",
      "reason": "Not applicable: review topic; review pages carry HTML and Markdown only"
    },
    "gift": {
      "status": "absent",
      "reason": "Not applicable: review topic; the review page is itself retrieval practice"
    },
    "video": {
      "status": "absent",
      "reason": "Not applicable: review topics carry HTML and Markdown only"
    },
    "lab": {
      "status": "absent",
      "reason": "Not applicable: review topic; hands-on practice is the S19 Review day's 'Practice without AI' platform block"
    }
  },
  "freshness": {
    "status": "unverified",
    "checkedAt": null,
    "sourcesRef": "authoring/evidence/python/source-snapshot.json",
    "unverifiedItems": [
      "Not yet verified: no page is authored yet. The intake froze first-party sources in authoring/evidence/python/source-snapshot.json (retrieved 2026-10-12); module PR SME criticism verifies every claim on the authored bytes against live sources."
    ]
  },
  "licensing": [],
  "lab": "none",
  "components": {}
}
