{
  "schemaVersion": 1,
  "id": "scope-and-closures",
  "title": "Scope and closures",
  "kind": "core",
  "curriculum": [
    {
      "pointer": "/tracks/1/weeks/4/days/2/topics/2",
      "calendarDayIds": [
        "S23"
      ],
      "relation": "exact"
    },
    {
      "pointer": "/tracks/2/weeks/2/days/2/topics/4",
      "calendarDayIds": [
        "FT13"
      ],
      "relation": "exact"
    }
  ],
  "objectives": [
    {
      "id": "o1",
      "text": "Identify which variables a function can see from its block, function and module scope"
    },
    {
      "id": "o2",
      "text": "Write a function that returns a closure keeping private state between calls"
    },
    {
      "id": "o3",
      "text": "Predict the values logged by callbacks created in a loop declared with let"
    }
  ],
  "prerequisites": [
    "html-css-js/javascript-fundamentals/let-const-and-equals",
    "html-css-js/javascript-fundamentals/functions-as-values-arrow-functions-and-callbacks"
  ],
  "minutes": {
    "aboutLabel": 10,
    "budget": 10,
    "modeledP50": 0,
    "modeledWorstPath": 0,
    "basis": "intake-plan: no page exists yet, so modeledP50 and modeledWorstPath are 0 (not measured). budget and aboutLabel are the intake planning allowance of 10 minutes per core topic, set from the measured course-1 range (estimator P50 4.78-7.95, worst-route labels 6-10) and checked against every mapped calendar day total. In the module PR the author sets modeledP50 to the frozen estimator P50, models the worst required route, and raises budget to at least ceil(max(P50, modeledWorstPath)) under docs/tools/validators.md (cap 15); budgets are never lowered below that minimum to fit a day. See evidence/html-css-js/intake.md, section Minute budgets."
  },
  "artifacts": {
    "html": {
      "status": "absent",
      "reason": "authored in the javascript-fundamentals module PR"
    },
    "md": {
      "status": "absent",
      "reason": "authored in the javascript-fundamentals module PR"
    },
    "pdf": {
      "status": "absent",
      "reason": "Not applicable: core topic; the PDF applies only to Reading topics or a printHandout topic"
    },
    "gift": {
      "status": "absent",
      "reason": "authored in the javascript-fundamentals module PR"
    },
    "video": {
      "status": "absent",
      "reason": "authored in the javascript-fundamentals module PR if a suitable verified live, public, embeddable video within the topic budget exists; otherwise recorded absent there with the search record"
    },
    "lab": {
      "status": "absent",
      "reason": "No coding lab: the confirmed coverage matrix gives the S22 and S23 rows no lab overlay; the page's own simulators carry the practice, and the S23 Practice-day exercise ladder is a platform activity; see evidence/html-css-js/intake.md, section Lab plan"
    }
  },
  "freshness": {
    "status": "unverified",
    "checkedAt": null,
    "sourcesRef": "evidence/html-css-js/source-snapshot.json",
    "unverifiedItems": [
      "Not yet verified: no page is authored yet. Official first-party sources for this topic were fetched live and frozen on 2026-10-12 in evidence/html-css-js/source-snapshot.json (list in evidence/html-css-js/intake.md, section Official sources per topic); the module PR binds each page claim to evidence/html-css-js/javascript-fundamentals/scope-and-closures/sources.json and SME criticism re-verifies it."
    ]
  },
  "licensing": [],
  "lab": "none",
  "components": {}
}
