{
  "schemaVersion": 1,
  "id": "handling-401-and-403-redirect-and-sign-out",
  "title": "Handling 401 and 403: redirect and sign out",
  "kind": "core",
  "curriculum": [
    {
      "pointer": "/tracks/1/weeks/6/days/3/topics/2",
      "calendarDayIds": [
        "S34"
      ],
      "relation": "exact"
    },
    {
      "pointer": "/tracks/2/weeks/3/days/3/topics/3",
      "calendarDayIds": [
        "FT19"
      ],
      "relation": "exact"
    }
  ],
  "objectives": [
    {
      "id": "o1",
      "text": "State the general HTTP meanings of 401 (the request lacks valid authentication credentials) and 403 (the server understood the request but refuses it), then apply the project API contract: 401 means sign in again, 403 means keep the session and show not-authorized"
    },
    {
      "id": "o2",
      "text": "On a 401, clear the client-side authentication state and redirect to the login page, remembering the page to return to, and distinguish that from the server ending an HttpOnly cookie session"
    },
    {
      "id": "o3",
      "text": "On a 403, show a not-allowed message instead of signing the user out"
    }
  ],
  "prerequisites": [
    "react/auth-and-review/protected-pages-and-role-based-screens"
  ],
  "minutes": {
    "aboutLabel": 10,
    "budget": 10,
    "modeledP50": 8,
    "modeledWorstPath": 10,
    "basis": "intake-plan: no page exists yet, so modeledP50 and modeledWorstPath are planning targets, not measurements. Targets: estimator P50 at most 8 minutes and worst required path (two wrong graded attempts and wrong-first explores per interactive unit) at most 10 minutes, set just above the measured course-1 range (estimator P50 4.78-7.95, worst path 6-9.35; evidence/git-linux-ai-foundations/intake.md). budget = ceil(max(modeledP50, modeledWorstPath)) per docs/tools/validators.md, capped at 15; aboutLabel covers the worst path. The module PR replaces modeledP50 with the frozen estimator's P50 on the page bytes and modeledWorstPath with the authored worst-path model, then re-derives budget and aboutLabel by the same rule. See evidence/react/intake.md, section Minute budgets."
  },
  "artifacts": {
    "html": {
      "status": "absent",
      "reason": "authored in the auth-and-review module PR"
    },
    "md": {
      "status": "absent",
      "reason": "authored in the auth-and-review module PR"
    },
    "pdf": {
      "status": "absent",
      "reason": "Not applicable: core topic; a PDF is present only for Reading topics and topics that declare a print handout"
    },
    "gift": {
      "status": "absent",
      "reason": "authored in the auth-and-review module PR"
    },
    "video": {
      "status": "absent",
      "reason": "authored in the auth-and-review module PR only if a documented search qualifies a live, public, embeddable video within the topic budget; otherwise recorded absent there with the search record"
    },
    "lab": {
      "status": "absent",
      "reason": "Standard: covered by the planned module lab react/auth-and-review/coding-lab/ for the S34 Lab day, authored in the auth-and-review module PR; on the Fast track (FT19) the topic is applied in step 4, a project-row brief, of the planned cumulative course project react/coding-lab/ (never a coding lab), authored in a course-level PR"
    }
  },
  "freshness": {
    "status": "unverified",
    "checkedAt": null,
    "sourcesRef": "evidence/react/source-snapshot.json",
    "unverifiedItems": [
      "No page is authored yet: the official source list was frozen live at intake on 2026-10-12 (evidence/react/source-snapshot.json); every claim is bound to those sources and verified by SME criticism in the auth-and-review module PR."
    ]
  },
  "licensing": [],
  "lab": "module:auth-and-review",
  "components": {}
}
