{
  "schemaVersion": 1,
  "id": "path-query-and-body-parameters",
  "title": "Path, query and body parameters",
  "kind": "core",
  "curriculum": [
    {
      "pointer": "/tracks/1/weeks/0/days/1/topics/1",
      "calendarDayIds": [
        "S2"
      ],
      "relation": "exact"
    },
    {
      "pointer": "/tracks/2/weeks/0/days/1/topics/1",
      "calendarDayIds": [
        "FT2"
      ],
      "relation": "exact"
    }
  ],
  "objectives": [
    {
      "id": "o1",
      "text": "Bind a path variable, a required and an optional query parameter and a JSON request body to handler method parameters with @PathVariable, @RequestParam and @RequestBody"
    },
    {
      "id": "o2",
      "text": "Predict the response status when a required query parameter is missing or a path variable cannot be converted to the declared type"
    },
    {
      "id": "o3",
      "text": "Choose whether a value belongs in the path, the query string or the body for a described request"
    }
  ],
  "prerequisites": [
    "spring-boot/spring-boot-basics/rest-controllers"
  ],
  "minutes": {
    "aboutLabel": 12,
    "budget": 12,
    "modeledP50": 9,
    "modeledWorstPath": 11.5,
    "basis": "intake planning model under the new-course budget rule (authoring/docs/tools/validators.md, Reading time): no artifact.html exists yet, so modeledP50 is the intake target for a core page (9 minutes) and modeledWorstPath adds 2.5 minutes for the worst required route (two wrong graded attempts and wrong-first explores per interactive unit; course-1 measured worst-path gaps were 2.41-2.65 minutes above P50). budget = aboutLabel = ceil(max(modeledP50, modeledWorstPath)) = 12. The spring-boot-basics module PR replaces modeledP50 with the frozen estimator P50 (authoring/tools/timing/estimate_reading.py, sha256 0deca96bf5e367aeae51a82abdbd4b6ce0d0289ecc9868c9eff3701016edf96f) on the authored bytes, re-models the worst path, and keeps budget at least ceil(max(P50, worst path)) and at most 15; T14 then checks the day totals. See authoring/evidence/spring-boot/intake.md, section Minute budgets."
  },
  "artifacts": {
    "html": {
      "status": "absent",
      "reason": "authored in the spring-boot-basics module PR"
    },
    "md": {
      "status": "absent",
      "reason": "authored in the spring-boot-basics module PR"
    },
    "pdf": {
      "status": "absent",
      "reason": "Not applicable: core topic with no print handout; in this course the PDF applies only to the five Reading topics"
    },
    "gift": {
      "status": "absent",
      "reason": "authored in the spring-boot-basics module PR"
    },
    "video": {
      "status": "absent",
      "reason": "authored in the spring-boot-basics module PR only if a live, public, embeddable first-party or reputable video qualifies within the budget; otherwise it stays absent with the search record"
    },
    "lab": {
      "status": "absent",
      "reason": "No topic coding lab: S1-S2 are Concept days with no lab overlay in the confirmed expected-artifact scope (matrix v3); the page's simulators carry the practice and the porting-and-configuration module lab applies these skills on the real toolchain; the educational critic confirms the omission"
    }
  },
  "freshness": {
    "status": "unverified",
    "checkedAt": null,
    "sourcesRef": "authoring/evidence/spring-boot/source-snapshot.json",
    "unverifiedItems": [
      "Not yet verified: no page is authored yet. The intake froze first-party sources in authoring/evidence/spring-boot/source-snapshot.json (retrieved 2026-10-13); module PR SME criticism verifies every claim on the authored bytes against live sources."
    ]
  },
  "licensing": [],
  "lab": "none",
  "components": {}
}
