{
  "schemaVersion": 1,
  "id": "collections-and-streams-review",
  "title": "Review: collections and streams",
  "kind": "review",
  "curriculum": [
    {
      "pointer": "/tracks/0/weeks/5/days/2/topics/0",
      "calendarDayIds": [
        "F28"
      ],
      "relation": "exact"
    }
  ],
  "objectives": [
    {
      "id": "o1",
      "text": "Retrieve, without notes, the collection, operation cost and equality rule that fit a described scenario"
    },
    {
      "id": "o2",
      "text": "Rewrite a loop that filters, transforms and groups data as an equivalent stream pipeline, and rewrite a stream pipeline as a loop"
    },
    {
      "id": "o3",
      "text": "Diagnose a collection or stream bug from its symptom: a missing hashCode, a ConcurrentModificationException, a reused stream or an unchecked Optional.get"
    }
  ],
  "prerequisites": [
    "collections-streams/collections-in-depth/choosing-the-right-collection",
    "collections-streams/lambdas-and-streams/grouping-with-streams-and-optional"
  ],
  "minutes": {
    "aboutLabel": 14,
    "budget": 14,
    "modeledP50": 11.71,
    "modeledWorstPath": 13.79,
    "basis": "Frozen estimator on the 2026-10-16 correction bytes: P50 11.71 minutes (code editors are marked data-interaction=terminal with data-steps for their modeled edit-and-Run cycles, the estimator category already used by repository code workspaces). The worst required route adds one extra graded attempt for the retrieval set (+45 s) and the diagnosis set (+45 s), and one extra Run for the editor (+35 s), giving 13.79 minutes. budget and aboutLabel are ceil(max(P50, worst path)) = 14, within the 15-minute ceiling."
  },
  "artifacts": {
    "html": {
      "status": "present"
    },
    "md": {
      "status": "present"
    },
    "pdf": {
      "status": "absent",
      "reason": "Not applicable: review topic; review topics carry HTML and Markdown only"
    },
    "gift": {
      "status": "absent",
      "reason": "Not applicable: review topic; the review page is itself retrieval practice, so review topics carry HTML and Markdown only"
    },
    "video": {
      "status": "absent",
      "reason": "Not applicable: review topic; review topics carry HTML and Markdown only"
    },
    "lab": {
      "status": "absent",
      "reason": "No coding lab: the page's own checks give the review practice, and the F28 Review day's 'Practice without AI' coding-lab block is platform practice, not a repository lab"
    }
  },
  "freshness": {
    "status": "partially-verified",
    "checkedAt": "2026-10-16",
    "sourcesRef": "authoring/evidence/collections-streams/lambdas-and-streams/collections-and-streams-review/sources.json",
    "unverifiedItems": [
      "Official Java SE 25, JLS, dev.java and PostgreSQL 18 sources linked by artifact.html returned HTTP 200 on 2026-10-16 (sources.json); Java/Streams-SME review of the current bytes is pending.",
      "Java behavior shown by the offline practice editor was checked against a local JDK 17 for the cases recorded in readiness evidence; Java SE 25 behavior is asserted from the official sources, not from a JDK 25 run.",
      "The current artifact bytes have not yet received the required independent education or Java/Streams-SME critic reviews."
    ]
  },
  "licensing": [],
  "lab": "none",
  "components": {}
}
