{
  "schemaVersion": 1,
  "id": "conditional-display",
  "title": "Conditional display",
  "kind": "core",
  "curriculum": [
    {
      "pointer": "/tracks/1/weeks/5/days/2/topics/3",
      "calendarDayIds": [
        "S28"
      ],
      "relation": "exact"
    },
    {
      "pointer": "/tracks/2/weeks/3/days/0/topics/6",
      "calendarDayIds": [
        "FT16"
      ],
      "relation": "exact"
    }
  ],
  "objectives": [
    {
      "id": "o1",
      "text": "Render different JSX with if statements, the conditional (? :) operator and logical &&"
    },
    {
      "id": "o2",
      "text": "Predict when a && condition renders 0 on screen and rewrite the condition to avoid it"
    },
    {
      "id": "o3",
      "text": "Return null from a component to render nothing"
    }
  ],
  "prerequisites": [
    "react/components-and-state/props"
  ],
  "minutes": {
    "aboutLabel": 10,
    "budget": 10,
    "modeledP50": 8,
    "modeledWorstPath": 10,
    "basis": "intake-plan: no page exists yet, so modeledP50 and modeledWorstPath are planning targets, not measurements. Targets: estimator P50 at most 8 minutes and worst required path (two wrong graded attempts and wrong-first explores per interactive unit) at most 10 minutes, set just above the measured course-1 range (estimator P50 4.78-7.95, worst path 6-9.35; evidence/git-linux-ai-foundations/intake.md). budget = ceil(max(modeledP50, modeledWorstPath)) per docs/tools/validators.md, capped at 15; aboutLabel covers the worst path. The module PR replaces modeledP50 with the frozen estimator's P50 on the page bytes and modeledWorstPath with the authored worst-path model, then re-derives budget and aboutLabel by the same rule. See evidence/react/intake.md, section Minute budgets."
  },
  "artifacts": {
    "html": {
      "status": "absent",
      "reason": "authored in the components-and-state module PR"
    },
    "md": {
      "status": "absent",
      "reason": "authored in the components-and-state module PR"
    },
    "pdf": {
      "status": "absent",
      "reason": "Not applicable: core topic; a PDF is present only for Reading topics and topics that declare a print handout"
    },
    "gift": {
      "status": "absent",
      "reason": "authored in the components-and-state module PR"
    },
    "video": {
      "status": "absent",
      "reason": "authored in the components-and-state module PR only if a documented search qualifies a live, public, embeddable video within the topic budget; otherwise recorded absent there with the search record"
    },
    "lab": {
      "status": "absent",
      "reason": "No topic lab: S28 is a Concept day with no calendar Lab day; the page simulator gives this topic's practice"
    }
  },
  "freshness": {
    "status": "unverified",
    "checkedAt": null,
    "sourcesRef": "evidence/react/source-snapshot.json",
    "unverifiedItems": [
      "No page is authored yet: the official source list was frozen live at intake on 2026-10-12 (evidence/react/source-snapshot.json); every claim is bound to those sources and verified by SME criticism in the components-and-state module PR."
    ]
  },
  "licensing": [],
  "lab": "none",
  "components": {}
}
