{
  "schemaVersion": 1,
  "id": "running-a-first-program",
  "title": "Running a first program",
  "kind": "core",
  "curriculum": [
    {
      "pointer": "/tracks/0/weeks/0/days/3/topics/1",
      "calendarDayIds": [
        "F4"
      ],
      "relation": "exact"
    }
  ],
  "objectives": [
    {
      "id": "o1",
      "text": "Compile a source file with javac and run the resulting class with java"
    },
    {
      "id": "o2",
      "text": "Run a single source file directly with java Hello.java and say when that shortcut is enough"
    },
    {
      "id": "o3",
      "text": "Fix a program from a compiler error message by locating its file, line and cause"
    }
  ],
  "prerequisites": [
    "java-foundations/java-basics/installing-java-and-the-ide"
  ],
  "minutes": {
    "aboutLabel": 10,
    "budget": 10,
    "modeledP50": 0,
    "modeledWorstPath": 0,
    "basis": "Intake planning budget for a core page under the new-course rule in docs/tools/validators.md (B8): no artifact.html exists yet, so modeledP50 and modeledWorstPath are 0 (not measured), not estimates. The planning value is the largest ceil(max(estimator P50, worst path)) measured on a course-1 page (10 minutes, agile-scrum-user-stories). The module PR measures the authored page with the frozen estimator, models the worst required path, and raises budget and aboutLabel to at least ceil(max(P50, modeledWorstPath)), at most 15, without compressing other topics. See evidence/java-foundations/intake.md, section Minute budgets."
  },
  "artifacts": {
    "html": {
      "status": "absent",
      "reason": "authored in the java-basics module PR"
    },
    "md": {
      "status": "absent",
      "reason": "authored in the java-basics module PR"
    },
    "pdf": {
      "status": "absent",
      "reason": "Not applicable: core topic with no print handout; the PDF applies only to pages derived from Reading source rows"
    },
    "gift": {
      "status": "absent",
      "reason": "authored in the java-basics module PR"
    },
    "video": {
      "status": "absent",
      "reason": "authored in the java-basics module PR when a suitable verified video exists; otherwise recorded absent there with the search record"
    },
    "lab": {
      "status": "absent",
      "reason": "No topic coding lab: the objectives are practised in the planned java-basics module lab (lab-contract pilot), authored in the java-basics module PR"
    }
  },
  "freshness": {
    "status": "unverified",
    "checkedAt": null,
    "sourcesRef": "evidence/java-foundations/source-snapshot.json",
    "unverifiedItems": [
      "Not yet verified in this repository: no page is authored. The module PR SME critic verifies every claim against the intake sources in evidence/java-foundations/source-snapshot.json and live official documentation."
    ]
  },
  "licensing": [],
  "lab": "module:java-basics",
  "components": {}
}
