{
  "schemaVersion": 1,
  "id": "demo-topic",
  "title": "Demo Topic",
  "kind": "core",
  "curriculum": [],
  "objectives": [],
  "prerequisites": [],
  "minutes": {
    "aboutLabel": 1,
    "budget": 1,
    "modeledP50": 1,
    "modeledWorstPath": 1,
    "basis": "fixture"
  },
  "artifacts": {
    "html": {
      "status": "present"
    },
    "md": {
      "status": "absent",
      "reason": "Not applicable."
    },
    "pdf": {
      "status": "absent",
      "reason": "Not applicable."
    },
    "gift": {
      "status": "absent",
      "reason": "Not applicable."
    },
    "video": {
      "status": "absent",
      "reason": "Not applicable."
    },
    "lab": {
      "status": "absent",
      "reason": "Not applicable."
    }
  },
  "freshness": {
    "status": "unverified",
    "checkedAt": null,
    "sourcesRef": "authoring/evidence/demo-course/demo-module/demo-topic/sources.json",
    "unverifiedItems": ["fixture"]
  },
  "licensing": [],
  "lab": "none",
  "components": {}
}
