{
  "schemaVersion": 1,
  "id": "accessibility-basics",
  "title": "Accessibility basics",
  "kind": "core",
  "curriculum": [
    {
      "pointer": "/tracks/1/weeks/3/days/4/topics/2",
      "calendarDayIds": [
        "S20"
      ],
      "relation": "exact"
    },
    {
      "pointer": "/tracks/2/weeks/2/days/1/topics/2",
      "calendarDayIds": [
        "FT12"
      ],
      "relation": "exact"
    }
  ],
  "objectives": [
    {
      "id": "o1",
      "text": "Identify missing alternative text, missing labels and keyboard traps in a sample page"
    },
    {
      "id": "o2",
      "text": "Choose a native HTML element over an ARIA role when both give the same behavior"
    },
    {
      "id": "o3",
      "text": "Check that every interactive control in a page can be reached and operated with the keyboard alone"
    }
  ],
  "prerequisites": [
    "html-css-js/html-and-css/semantic-html-page-structure",
    "html-css-js/html-and-css/forms-and-html5-validation"
  ],
  "minutes": {
    "aboutLabel": 10,
    "budget": 10,
    "modeledP50": 0,
    "modeledWorstPath": 0,
    "basis": "intake-plan: no page exists yet, so modeledP50 and modeledWorstPath are 0 (not measured). budget and aboutLabel are the intake planning allowance of 10 minutes per core topic, set from the measured course-1 range (estimator P50 4.78-7.95, worst-route labels 6-10) and checked against every mapped calendar day total. In the module PR the author sets modeledP50 to the frozen estimator P50, models the worst required route, and raises budget to at least ceil(max(P50, modeledWorstPath)) under docs/tools/validators.md (cap 15); budgets are never lowered below that minimum to fit a day. See authoring/evidence/html-css-js/intake.md, section Minute budgets."
  },
  "artifacts": {
    "html": {
      "status": "absent",
      "reason": "authored in the html-and-css module PR"
    },
    "md": {
      "status": "absent",
      "reason": "authored in the html-and-css module PR"
    },
    "pdf": {
      "status": "absent",
      "reason": "Not applicable: core topic; the PDF applies only to Reading topics or a printHandout topic"
    },
    "gift": {
      "status": "absent",
      "reason": "authored in the html-and-css module PR"
    },
    "video": {
      "status": "absent",
      "reason": "authored in the html-and-css module PR if a suitable verified live, public, embeddable video within the topic budget exists; otherwise recorded absent there with the search record"
    },
    "lab": {
      "status": "absent",
      "reason": "No coding lab: the objectives are practised in the page's own simulators, and this topic falls on a Concept day with no calendar lab day; see authoring/evidence/html-css-js/intake.md, section Lab plan"
    }
  },
  "freshness": {
    "status": "unverified",
    "checkedAt": null,
    "sourcesRef": "authoring/evidence/html-css-js/source-snapshot.json",
    "unverifiedItems": [
      "Not yet verified: no page is authored yet. Official first-party sources for this topic were fetched live and frozen on 2026-10-12 in authoring/evidence/html-css-js/source-snapshot.json (list in authoring/evidence/html-css-js/intake.md, section Official sources per topic); the module PR binds each page claim to authoring/evidence/html-css-js/html-and-css/accessibility-basics/sources.json and SME criticism re-verifies it."
    ]
  },
  "licensing": [],
  "lab": "none",
  "components": {}
}
